{"$schema":"https://json-schema.org/draft/2020-12/schema","$id":"https://ai-sdlc.dev/schema/operator/store/semantic-reservation.schema.json","title":"Immutable semantic effect reservation","type":"object","required":["semantic_effect_key","external_dispatch_key","target_repository","feature_id","expected_revision","current_stage","task_identity","role","candidate_head_sha","created_operation_id","created_generation","created_at","trusted_context_digest"],"properties":{"semantic_effect_key":{"type":"string","pattern":"^[0-9a-f]{64}$"},"external_dispatch_key":{"type":"string","pattern":"^dispatch-[0-9a-f]{40}$"},"target_repository":{"type":"string"},"feature_id":{"type":"string"},"expected_revision":{"type":"integer","minimum":0},"current_stage":{"type":"string"},"task_identity":{"type":"string"},"role":{"type":"string"},"candidate_head_sha":{"type":["string","null"]},"created_operation_id":{"type":"string"},"created_generation":{"type":"integer","minimum":0},"created_at":{"type":"string"},"trusted_context_digest":{"type":"string"}},"additionalProperties":false}
