{"candidate_head_sha":"f7d1cb4f5c6719c6f87933007434a78ce13875c2","created_at":"2026-09-27T10:37:44Z","created_generation":0,"created_operation_id":"op-345c3c1fb5ebcf1e9306d744b49985e3a6bfaa0e","current_stage":"code-review","expected_revision":1,"external_dispatch_key":"dispatch-5f5ad0ae9bd9570a21c20b0f9880ce97af35147f","feature_id":"F-OPERATOR-V03-REAL-RUNTIME-FI-0034","role":"reviewer","semantic_effect_key":"a2b8127966309d19e190d4415844d4ae41509d3432fb61dc72a4d779228bb514","target_repository":"dream-xin/ai-sdlc","task_identity":"vertical:code-review:f7d1cb4f5c6719c6f87933007434a78ce13875c2","trusted_context_digest":"9c71e8e93c134954ad26718b161364bf74160272c574638019e002d71e297881"}
