{"candidate_head_sha":"6d3bedc65dd6848c2ef52a2b2c3ba61cd1a12727","created_at":"2026-10-02T08:05:03Z","created_generation":0,"created_operation_id":"op-198ddd1f51d1de17c914adb797f78a112129a929","current_stage":"code-review","expected_revision":1,"external_dispatch_key":"dispatch-3cdd346242c33dcb83e15afa4be91503d568cf49","feature_id":"F-OPERATOR-V03-FI-UNKNOWN-TAKEOVER-0005","role":"reviewer","semantic_effect_key":"116c56d5a45db0b3ad61771c3bcbb334baf0a25091e619d4eb9004bbaa58451b","target_repository":"dream-xin/ai-sdlc","task_identity":"vertical:code-review:6d3bedc65dd6848c2ef52a2b2c3ba61cd1a12727","trusted_context_digest":"77d68b1fa4e3e1bc7e9f8703dfef5aad80b7445648bd3372792e6c4b799f7c51"}
