{"candidate_head_sha":"e9859770fdc542655c1dd1f3b2661087df707de6","created_at":"2026-10-02T14:27:59Z","created_generation":0,"created_operation_id":"op-e16b5bb2be6e0397e72560dfff1c1d5823e00b43","current_stage":"code-review","expected_revision":1,"external_dispatch_key":"dispatch-892139cf76bdfde5580996a3189036649b07204a","feature_id":"F-OPERATOR-V03-FI-UNKNOWN-TAKEOVER-0009","role":"reviewer","semantic_effect_key":"e62917fd86b252c5eb2424213dfbb4af009ee73a63ed33ca0a20641e74630274","target_repository":"dream-xin/ai-sdlc","task_identity":"vertical:code-review:e9859770fdc542655c1dd1f3b2661087df707de6","trusted_context_digest":"fb1d7997f60063cc36ef1a27d2ba489b9e85c529f5ef59eb177e886362709060"}
