{"candidate_head_sha":"1c838b6770c371cf347ed6b1a23640bbb3b72846","created_at":"2026-09-27T11:14:23Z","created_generation":0,"created_operation_id":"op-6d8b2c7ada6a7ef8f3f30d52ac7840fbb75361ec","current_stage":"code-review","expected_revision":1,"external_dispatch_key":"dispatch-47848d29d76458f8d74b668ba7cc93a7ff15ca88","feature_id":"F-OPERATOR-V03-FI-UNKNOWN-TAKEOVER-0004","role":"reviewer","semantic_effect_key":"3174d92b15ec1e1d42c3cf9cf918fbe15e1c202b7cdaf52ac4b9913dfc3988e1","target_repository":"dream-xin/ai-sdlc","task_identity":"vertical:code-review:1c838b6770c371cf347ed6b1a23640bbb3b72846","trusted_context_digest":"2332b5c09de44efef08fd80c260548ab45435c1a6c03d5f51726d01c7eb403e3"}
