{"candidate_head_sha":"142d33f61ad542ab06dd30da971aef7cef21fac7","created_at":"2026-09-25T09:36:50Z","created_generation":0,"created_operation_id":"op-5550b63e32adab052447b7c6a377b6251f278171","current_stage":"code-review","expected_revision":1,"external_dispatch_key":"dispatch-61bddb762db0d8987d9fdc0d62c548294feff4f0","feature_id":"F-OPERATOR-V03-REAL-RUNTIME-FI-0008","role":"reviewer","semantic_effect_key":"06f0946c215ac8b97ddc873c40cd31232b0917aa076657312748bc1aa4957252","target_repository":"dream-xin/ai-sdlc","task_identity":"vertical:code-review:142d33f61ad542ab06dd30da971aef7cef21fac7","trusted_context_digest":"5a7c96663d87e20810b859816e141f2be4ead621b0f3d022d5941e2e5606e3f0"}
