{"candidate_head_sha":"b9599a777aea6f648893f8cd81fad73757e7e3d9","created_at":"2026-10-02T06:56:13Z","created_generation":0,"created_operation_id":"op-1ba85403333840e84e2438aef43d28e2e4581142","current_stage":"code-review","expected_revision":1,"external_dispatch_key":"dispatch-aa2192ce3dc84efe696d5b1f8d465098663e0cb8","feature_id":"F-OPERATOR-V03-REAL-RUNTIME-FI-0045","role":"reviewer","semantic_effect_key":"33c04ee5f4a4a37804d0dd8448a05b3469cdc114b08f32f05c27b7d767966027","target_repository":"dream-xin/ai-sdlc","task_identity":"vertical:code-review:b9599a777aea6f648893f8cd81fad73757e7e3d9","trusted_context_digest":"d552406545a210e40e9a03da70da94b805412aa877d6df29c2b801b210ae89bb"}
