{"candidate_head_sha":"42bb5e2c4e9701eac375695b5cb2b8e78c6f5c2d","created_at":"2026-10-02T07:19:45Z","created_generation":0,"created_operation_id":"op-5d48298138da23ae8959accdbf9199b62a3183b0","current_stage":"code-review","expected_revision":1,"external_dispatch_key":"dispatch-b08d96d277029ed88bf13163d06ed1382d33ef8d","feature_id":"F-OPERATOR-V03-REAL-RUNTIME-FI-0046","role":"reviewer","semantic_effect_key":"9cb3dc7f487071cb831dd4862000fe11633c148760b3a64173f428ad6a2a4a6d","target_repository":"dream-xin/ai-sdlc","task_identity":"vertical:code-review:42bb5e2c4e9701eac375695b5cb2b8e78c6f5c2d","trusted_context_digest":"071c84b6582034115b1d6280809dec62da4b52ba1598f4d2b32b047e860d33b0"}
