{"candidate_head_sha":"a02f77d0f5be744f65e8ae9f1bb8851dea941c47","created_at":"2026-10-02T14:02:55Z","created_generation":0,"created_operation_id":"op-21fe2507d3b128bca90e49ee0b6ea703e806ac30","current_stage":"code-review","expected_revision":1,"external_dispatch_key":"dispatch-a54d68fb1a97294dc2915788d77aa097c55f9108","feature_id":"F-OPERATOR-V03-REAL-RUNTIME-FI-0051","role":"reviewer","semantic_effect_key":"0d9f7326099408c51ad44939f62b2f9700817e0a9ebb179ef1134794210f50b7","target_repository":"dream-xin/ai-sdlc","task_identity":"vertical:code-review:a02f77d0f5be744f65e8ae9f1bb8851dea941c47","trusted_context_digest":"c4eb8caefed840ce50c9f92bad852482960e0f74aac6596c535d9160efcaa2d1"}
