{"candidate_head_sha":"1ce00975aec6791be590882f293629115f7b1eee","created_at":"2026-10-02T10:13:00Z","created_generation":0,"created_operation_id":"op-759ab1f57d6aeca7624a2a09e2a0f2a62aca0928","current_stage":"code-review","expected_revision":1,"external_dispatch_key":"dispatch-2d94d2cf30aefd2338d6cfe7d8a56c0abfbb0993","feature_id":"F-OPERATOR-V03-FI-PREAUTH-CRASH-0002","role":"reviewer","semantic_effect_key":"ff7569087e5ee720ce64f5dff3b381ac4af5ac765276aba4d85e6f920f7da43a","target_repository":"dream-xin/ai-sdlc","task_identity":"vertical:code-review:1ce00975aec6791be590882f293629115f7b1eee","trusted_context_digest":"5eddeeff88b07c674e01ed49e99895198911b1379c25f899b2e3cdcd331a4d55"}
