{"candidate_head_sha":"e7652ae2450d3dd3ed2698fab3ce9fe6e8e134bf","created_at":"2026-10-02T08:41:54Z","created_generation":0,"created_operation_id":"op-152cf56ab312b25eebb80801734999a882e6fe4c","current_stage":"code-review","expected_revision":1,"external_dispatch_key":"dispatch-df325d52ef6ab099c082e18a5f5e123ce69d3b1c","feature_id":"F-OPERATOR-V03-REAL-RUNTIME-FI-0048","role":"reviewer","semantic_effect_key":"d3f266f47d0c4b1cf48d538e466d89729c4daa6c8028b48244fd94db6d3fd50f","target_repository":"dream-xin/ai-sdlc","task_identity":"vertical:code-review:e7652ae2450d3dd3ed2698fab3ce9fe6e8e134bf","trusted_context_digest":"e4bb64e8d07e987f8543754d7e632786bad2c49c86cb31db064041a1e9e19ad5"}
