{"candidate_head_sha":"d0fe528cce2bf9bb8041029f3d496e2659da2e4b","created_at":"2026-09-27T09:14:50Z","created_generation":0,"created_operation_id":"op-e748b521e8e48ec5a61b94f3811407366dc74ff2","current_stage":"code-review","expected_revision":1,"external_dispatch_key":"dispatch-7a8bc0990e9647f10a7ee25eb865e6313073aae4","feature_id":"F-OPERATOR-V03-REAL-RUNTIME-FI-0032","role":"reviewer","semantic_effect_key":"391fc37cf8f8e38f43f004aaba745fbacaa1940f307b9f845cbbaaae3dd74a10","target_repository":"dream-xin/ai-sdlc","task_identity":"vertical:code-review:d0fe528cce2bf9bb8041029f3d496e2659da2e4b","trusted_context_digest":"e254786d7a8f072a9d399c22c23e11758c8767bb3aa2c675225302f8c1e0a4f9"}
