{"candidate_head_sha":"3cacb2d542f2cd0ca69f7e64ee712fa1186b26af","created_at":"2026-10-02T09:16:16Z","created_generation":0,"created_operation_id":"op-f84597e8a650cc1400d9ab13a42a9615fc1bab53","current_stage":"code-review","expected_revision":1,"external_dispatch_key":"dispatch-a2f800a1eccaddcbfe5b91a8190446e8f80d3dae","feature_id":"F-OPERATOR-V03-FI-PREAUTH-CRASH-0001","role":"reviewer","semantic_effect_key":"b8e95292056354ad46ab35e1b8da03c7043df8ecbf36d27c62e21f262c8936b4","target_repository":"dream-xin/ai-sdlc","task_identity":"vertical:code-review:3cacb2d542f2cd0ca69f7e64ee712fa1186b26af","trusted_context_digest":"46fd1b6f1d888a66a38f96d78b0dd7b9c4a31857913f914f83a23b4fec7fb121"}
